{
  "id": "example:record",
  "recordType": "Procedure.PatternHypothesis",
  "schemaVersion": 1,
  "createdAt": "2026-10-01T07:10:00.000Z",
  "updatedAt": "2026-10-01T07:10:00.000Z",
  "ownerId": "local:owner",
  "siteKey": "example",
  "patternKey": "aaaaaaaaaaaaaaaaaaaaaaaaaaaaaaaaaaaaaaaaaaaaaaaaaaaaaaaaaaaaaaaa",
  "algorithmVersion": 1,
  "occurrences": 1,
  "windowStart": "2026-10-01T07:10:00.000Z",
  "expiresAt": "2026-10-01T07:10:00.000Z",
  "summary": "example",
  "status": "candidate",
  "observationRefs": []
}